{
  "id": "urn:ngsi-ld:RAMI40:I4Asset:iCrate:IC001",
  "type": "I4Asset",  
  "hasDataSpecification": [],
  "assetIdentificationModelRef": {
    "keys": [
      {
        "type": "Submodel",
        "local": true,
        "value": "urn:ngsi-ld:RAMI40:I4Submodel:Nameplate:IC001",
        "index": 0,
        "idType": "IRI"
      }
    ]
  },
  "billOfMaterialRef": {
    "keys": [
      {
        "type": "Submodel",
        "local": true,
        "value": "urn:ngsi-ld:RAMI40:I4Submodel:BillOfMaterial:IC001",
        "index": 0,
        "idType": "IRI"
      }
    ]
  },
  "identification": {
    "idType": "IRI",
    "id": "urn:ngsi-ld:RAMI40:I4Asset:iCrate:IC001"
  },
  "administration": {
    "version": "1.0",
    "revision": ""
  },
  "idShort": "IC001",
  "category": "CONSTANT",
  "modelType": {
    "name": "Asset"
  },
  "kind": "Instance",
  "descriptions": [
    {
      "language": "en",
      "text": "Intelligent crate asset for IC001"
    }
  ]
}